19:07:22.358167 IP 10.200.24.43 > all-systems.mcast.net: igmp query v2
19:07:26.999643 IP 172.20.50.233 > 224.0.0.251: igmp v2 report 224.0.0.251
19:07:39.458941 IP 172.20.50.233.10384 > zafiro.usal.es.domain: 62115+ A? informatica.usal.es. (37)
19:07:39.458952 IP 172.20.50.233.10384 > agata.usal.es.domain: 62115+ A? informatica.usal.es. (37)
19:07:39.461944 IP zafiro.usal.es.domain > 172.20.50.233.10384: 62115* 2/3/3 CNAME roble.fis.usal.es., A 212.128.144.90 (188)
19:07:39.461961 IP agata.usal.es.domain > 172.20.50.233.10384: 62115* 2/3/3 CNAME roble.fis.usal.es., A 212.128.144.90 (188)
19:07:39.462159 IP 172.20.50.233 > roble.fis.usal.es: ICMP echo request, id 6832, seq 1, length 64
19:07:40.469770 IP 172.20.50.233 > roble.fis.usal.es: ICMP echo request, id 6832, seq 2, length 64
19:07:41.477819 IP 172.20.50.233 > roble.fis.usal.es: ICMP echo request, id 6832, seq 3, length 64
19:07:42.326294 IP 10.200.24.43 > all-systems.mcast.net: igmp query v2
19:07:42.485860 IP 172.20.50.233 > roble.fis.usal.es: ICMP echo request, id 6832, seq 4, length 64
19:07:43.831638 IP 172.20.50.233 > 224.0.0.251: igmp v2 report 224.0.0.251
19:07:44.471650 ARP, Request who-has 172.20.48.1 tell 172.20.50.233, length 28
19:07:44.475692 ARP, Reply 172.20.48.1 is-at 00:0a:42:38:ec:00 (oui Unknown), length 28
19:07:48.862206 IP 172.20.50.233.5805 > zafiro.usal.es.domain: 38398+ A? informatica.usal.es. (37)
19:07:48.864954 IP zafiro.usal.es.domain > 172.20.50.233.5805: 38398* 2/3/3 CNAME roble.fis.usal.es., A 212.128.144.90 (188)
19:08:02.294302 IP 10.200.24.43 > all-systems.mcast.net: igmp query v2
19:08:04.875771 IP 172.20.50.233.27284 > zafiro.usal.es.domain: 14661+ A? informatica.usal.es. (37)
19:08:04.875783 IP 172.20.50.233.27284 > agata.usal.es.domain: 14661+ A? informatica.usal.es. (37)
19:08:04.879873 IP zafiro.usal.es.domain > 172.20.50.233.27284: 14661* 2/3/3 CNAME roble.fis.usal.es., A 212.128.144.90 (188)
19:08:04.879889 IP agata.usal.es.domain > 172.20.50.233.27284: 14661* 2/3/3 CNAME roble.fis.usal.es., A 212.128.144.90 (188)
19:08:04.880028 IP 172.20.50.233 > roble.fis.usal.es: ICMP echo request, id 6856, seq 1, length 64
19:08:04.882345 IP roble.fis.usal.es > 172.20.50.233: ICMP echo reply, id 6856, seq 1, length 64
19:08:04.882575 IP 172.20.50.233.6487 > zafiro.usal.es.domain: 3340+ PTR? 90.144.128.212.in-addr.arpa. (45)
19:08:04.885414 IP zafiro.usal.es.domain > 172.20.50.233.6487: 3340* 1/5/6 PTR roble.fis.usal.es. (293)
19:08:11.367654 IP 172.20.50.233 > 224.0.0.251: igmp v2 report 224.0.0.251
19:08:22.364596 IP 10.200.24.43 > all-systems.mcast.net: igmp query v2
19:08:23.295652 IP 172.20.50.233 > 224.0.0.251: igmp v2 report 224.0.0.251
